{
  "slug": "oss-security",
  "name": "OSs-security",
  "description": "Factory reset & harden your configuration: Linux, macOS, & Windows.",
  "repo_url": "https://github.com/Opsek/OSs-security",
  "maintainer_slug": "opsek",
  "tags": [
    "hardening",
    "linux",
    "macos"
  ],
  "stars": 30
}
