{
  "slug": "mythril",
  "name": "Mythril",
  "description": "Security analysis tool for EVM bytecode using symbolic execution, SMT solving, and taint analysis to detect vulnerabilities in Ethereum smart contracts.",
  "repo_url": "https://github.com/ConsenSysDiligence/mythril",
  "maintainer_slug": "consensys-diligence",
  "tags": [
    "symbolic-execution",
    "solidity",
    "evm"
  ],
  "stars": 4252
}
