{
  "slug": "openzeppelin-contracts",
  "name": "OpenZeppelin Contracts",
  "description": "Battle-tested library of secure, reusable smart contracts for Ethereum. Implements ERC standards and common patterns (access control, upgrades, governance) audited by the community.",
  "repo_url": "https://github.com/OpenZeppelin/openzeppelin-contracts",
  "maintainer_slug": "openzeppelin",
  "tags": [
    "solidity",
    "library",
    "standards"
  ],
  "stars": 27160
}
