{
  "slug": "slither",
  "name": "Slither",
  "description": "Static analysis framework for Solidity and Vyper smart contracts. Detects vulnerabilities, provides code understanding, and automates custom analyses via a Python API.",
  "repo_url": "https://github.com/crytic/slither",
  "maintainer_slug": "trail-of-bits",
  "tags": [
    "static-analysis",
    "solidity",
    "vyper"
  ],
  "stars": 6304
}
